{
  "envelope_id": "550e8400-e29b-41d4-a716-446655440046",
  "signature_type": "commitment",
  "key_ref": "kms://example/key-46",
  "signed_payload_hash": "sha256:0000000000000000000000000000000000000000000000000000000000000000",
  "signature_value": "ed25519:BBBBBBBBBBBBBBBBBBBBBBBBBBBBBBBBBBBBBBBBBBBBBBBBBBBBBBBBBBBBBBBBBBBBBBBBBBBBBBBBBBBBBB",
  "signed_at": "2026-05-07T02:00:00Z",
  "contract_version": "8.5.0"
}
